{
  "run_id": "run_e4c76bc3",
  "keyword": "test keyword",
  "started_at": "2026-02-21T16:03:04.655112+00:00",
  "ended_at": "2026-02-21T16:03:04.655136+00:00",
  "config": {
    "max_videos": 5,
    "discovery_only": false
  },
  "errors": [],
  "env": {
    "python_version": "3.12.12",
    "platform": "Linux-6.12.47-x86_64-with-glibc2.39",
    "has_youtube_api_key": false
  }
}